Unnamed: 0,id,tweet_url,created_at,parsed_created_at,user_screen_name,text,tweet_type,coordinates,hashtags,media,urls,favorite_count,in_reply_to_screen_name,in_reply_to_status_id,in_reply_to_user_id,lang,place,possibly_sensitive,retweet_count,retweet_or_quote_id,retweet_or_quote_screen_name,retweet_or_quote_user_id,source,user_id,user_created_at,user_default_profile_image,user_description,user_favourites_count,user_followers_count,user_friends_count,user_listed_count,user_location,user_name,user_statuses_count,user_time_zone,user_urls,user_verified,hour,date,vaccine name,product name,company name,side effects,risks,benefits,vaccine benefits,organization,vaccine type,regulatory status,clinical trial phase,vaccination campaign,adverse reaction,immunization rate,public health policy,vaccine efficacy,vaccine safety,population segment,marketing strategy,public opinion,government funding,regulatory decision,economic impact
496,1448992075656179714,https://twitter.com/RoSiMa318/status/1448992075656179714,Fri Oct 15 12:40:06 +0000 2021,2021-10-15 12:40:06,RoSiMa318,💉 COVID-19 | Le #vaccin #Moderna est déconseillé pour les doses de rappel par la Haute Autorité de #Santé.  (LP) #COVID19,retweet,,vaccin moderna santé covid19,,,703,,,,fr,,,130,1.448990731738169e+18,ConflitsFrance,971820228.0,<a href=,910235471653064704,Tue Sep 19 20:13:42 +0000 2017,False,𝓢𝓾𝓹𝓹𝓸𝓻𝓽𝓮𝓻 𝓭𝓮 𝓛’𝓞𝓵𝔂𝓶𝓹𝓲𝓺𝓾𝓮 𝓭𝓮 𝓜𝓪𝓻𝓼𝓮𝓲𝓵𝓵𝓮 ⭐️ #TeamOM #SouthWinners #Sw87🇧🇪🇪🇸#AntiQSG #NissaMerda,11101,876,715,0,Istres,RoSiMa ✪,5277,,,FALSE,12,2021-10-15,Moderna,,,,,,,"Haute Autorité de #Santé, LP",,,,,,,,,,,,,,,
497,1351028310244028416,https://twitter.com/brunornc1/status/1351028310244028416,Mon Jan 18 04:47:04 +0000 2021,2021-01-18 04:47:04,brunornc1,« Des documents confidentiels consultés par @lemondefr montrent la pression subie par lAgence Européenne du Médicament pour approuver le vaccin Pfizer-BioNTech » NOUVEAU SCANDALE EN VUE ! https://t.co/166nOjBbKd,retweet,,,,,64,,,,fr,,,56,1.3510243232141353e+18,gDesFaits,1.3071582395959747e+18,<a href=,1317366651210420225,Sat Oct 17 07:27:50 +0000 2020,False,"Le socialisme n'a pour les ouvriers que mépris et dégoût. Le socialisme ne fonctionne qu'au paradis, où l'on peut s'en passer, et en enfer, où on l'a vraiment..",10881,536,697,3,La France Chrétienne..,brunornc,30277,,,False,4,2021-01-18,Pfizer-BioNTech,,,,,,,,,,,,,,,,,,,,,,
498,1307259271269163010,https://twitter.com/GxP_Services_FR/status/1307259271269163010,Sat Sep 19 10:04:32 +0000 2020,2020-09-19 10:04:32,GxP_Services_FR,COVID-19 : Sanofi et GSK vont fournir jusqu’à 300 millions de doses de leur vaccin à l’UE https://t.co/ONiUdYkUZK,original,,,,https://bit.ly/2HeWu4e,0,,,,fr,,False,0,,,,"<a href=""https://dlvrit.com/"" rel=""nofollow"">dlvr.it</a>",258262888,Sun Feb 27 09:24:30 +0000 2011,False,GxP est spécialisé dans les services linguistiques pour les secteurs pharma/médical/Med Tech/HIT. #health20fr #HIT #esanté Compte francophone de @GxP_Services,0,541,641,63,"Freiburg, Allemagne",GxP LanguageServices,62656,,http://gxplanguageservices.com/,FALSE,10,2020-09-19,,,"Sanofi, GSK",,,,,,,,,,,,,,,,,,,,
499,1456314198661730311,https://twitter.com/jcd92410/status/1456314198661730311,Thu Nov 04 17:35:36 +0000 2021,2021-11-04 17:35:36,jcd92410,Quoi comment Pfizer aurait falsifié des données d’essais cliniques ? Étonnant non ? https://t.co/bbknkSnb7r,retweet,,,,,875,,,,fr,,,317,1.4562987631910339e+18,fquedeville,111325515.0,<a href=,104757952,Thu Jan 14 08:58:39 +0000 2010,False,,5014,356,262,13,France,jc dauphin,30194,,,FALSE,17,2021-11-04,,,Pfizer,,,,,,,,,,,,,,,,,,,,
500,1374987324271034369,https://twitter.com/maralpoutine/status/1374987324271034369,Thu Mar 25 07:31:38 +0000 2021,2021-03-25 07:31:38,maralpoutine,"Pendant ce temps, l'Afrique du Sud revend ses doses inefficaces #AstraZeneca contre son variant à l'@AfricanUnionUN -Quels sont les prochains pays cobayes? -Les variants ont des frontières? L'Af. du Sud poursuit ses expérimentations avec #johnsonandjohnson https://t.co/w0taynAgDk",retweet,,astrazeneca johnsonandjohnson,,,639,,,,fr,,,371,1.37428758311988e+18,CaudeHenrion,1.346890637690499e+18,<a href=,4228895379,Thu Nov 19 20:13:06 +0000 2015,True,,72214,832,175,208,,maral,345343,,,False,7,2021-03-25,johnsonandjohnson,,AstraZeneca,,,,,,,,,,,,,,,,,,,,
501,1371565968095330306,https://twitter.com/Patrici44097355/status/1371565968095330306,Mon Mar 15 20:56:23 +0000 2021,2021-03-15 20:56:23,Patrici44097355,EN DIRECT #Covid : la France suspend à son tour le vaccin d'AstraZeneca https://t.co/djCMZJOIEO https://t.co/rO92tY1s7V,retweet,,covid,https://pbs.twimg.com/media/Ewi5QdHWYAUW1NT.jpg,https://trib.al/3V2lRfN,18,,,,fr,,False,13,1.3715497809718272e+18,LesEchos,92564226.0,<a href=,870874025236602880,Sat Jun 03 05:25:22 +0000 2017,False,,298,42,108,1,,Patricia bastien,1314,,,False,20,2021-03-15,,,AstraZeneca,,,,,,,,,,,,,,,,,,,,
502,1366414903385456645,https://twitter.com/Richard_trois/status/1366414903385456645,Mon Mar 01 15:47:54 +0000 2021,2021-03-01 15:47:54,Richard_trois,"Si le #vaccin #Astrazeneca est aussi recommandé pour les + de 65 ans, ça change tout. Ce serait une très bonne nouvelle car le calendrier de #vaccination pourrait bien s'en trouver accéléré. https://t.co/tV0ogoWfTL",retweet,,vaccin astrazeneca vaccination,,,45,,,,fr,,,12,1.3663968459420672e+18,tcabarrus,338955445.0,<a href=,541557919,Sat Mar 31 10:56:19 +0000 2012,False,,492468,2669,2637,235,,Dom Richard ?? ??,265659,,,False,15,2021-03-01,,,,,,,,Astrazeneca,,,,calendrier de #vaccination,,,,,,+ de 65 ans,,,,,
503,1369978253176356869,https://twitter.com/lalyRose6/status/1369978253176356869,Thu Mar 11 11:47:23 +0000 2021,2021-03-11 11:47:23,lalyRose6,EN DIRECT - Covid-19 : le Danemark suspend l'utilisation du vaccin AstraZeneca https://t.co/cMFdP7ywTH https://t.co/kuSpMUE7pN,retweet,,,https://pbs.twimg.com/media/EwMSjxaXEAAoMUf.jpg,https://bit.ly/2OCP8uZ,26,,,,fr,,False,36,1.3699591206405652e+18,LCI,26110930.0,<a href=,1244910022536179712,Tue Mar 31 08:51:05 +0000 2020,False,,3370,28,25,0,,laly _ Rose,660,,,False,11,2021-03-11,AstraZeneca,,,,,,,,,,,,,,,,,,,,,,
504,1457116373323288585,https://twitter.com/AlfredFresh2/status/1457116373323288585,Sat Nov 06 22:43:09 +0000 2021,2021-11-06 22:43:09,AlfredFresh2,@DIGITLSPARTN Voici pour vos archives 🤗  https://t.co/la2pvTXq1S  #COVID19 #Pfizergate #NonAuPassDeLaHonte #NonAuVaccinObligatoire https://t.co/ROrIl9MsR0,retweet,,covid19 pfizergate nonaupassdelahonte nonauvaccinobligatoire,,https://youtu.be/p6JzVyPKyIk,14,,,,fr,,False,18,1.4559299492238868e+18,emmapeels_,1.343340832770941e+18,<a href=,1438086638463225856,Wed Sep 15 10:26:26 +0000 2021,False,Auteur conspirateur,10608,326,55,0,,Alfred Fresh,5451,,,FALSE,22,2021-11-06,"Pfizergate, NonAuPassDeLaHonte, NonAuVaccinObligatoire",,,,,,,,,,,,,,,,,,,,,,
505,1369315577316147202,https://twitter.com/coeurdestemps/status/1369315577316147202,Tue Mar 09 15:54:08 +0000 2021,2021-03-09 15:54:08,coeurdestemps,"USA Trisha Noble, RIP, 43 ans, est décédée dun arrêt cardiaque dans les bras de son mari quelques heures après avoir reçu le vaccin Pfizer Covid-19. Elle était mère, grand-mère, épouse et travailleuse de première ligne https://t.co/BjBIgLMlCi",retweet,,,,,19,,,,fr,,,17,1.3679036574344888e+18,DP_2020_,840190609.0,<a href=,1343176016064339969,Sun Dec 27 12:48:05 +0000 2020,False,« Il est plus facile de tromper les gens que de les convaincre qu'ils ont été trompés » Mark Twain #touchepasamesenfants #NosEnfantsPasDesCobayes,37412,902,1513,4,,ZAY,35056,,,False,15,2021-03-09,,,Pfizer,,,,,,,,,,,,,,,,,,,,
506,1383024612829696004,https://twitter.com/hevanessance/status/1383024612829696004,Fri Apr 16 11:48:57 +0000 2021,2021-04-16 11:48:57,hevanessance,Covid-19. Une troisième dose du vaccin Pfizer sera «probablement» nécessaire https://t.co/Zk2TiPVDb7,retweet,,,,http://hi.switchy.io/45n2,24,,,,fr,,False,26,1.3828077934267023e+18,OuestFrance,35777570.0,<a href=,1551310946,Thu Jun 27 19:08:10 +0000 2013,False,,10299,29,515,9,,Mace vanessa,20676,,,False,11,2021-04-16,,,Pfizer,,,,,,,,,,,,,,,,,,,,
507,1334413104655048704,https://twitter.com/Biomotive_info/status/1334413104655048704,Thu Dec 03 08:24:11 +0000 2020,2020-12-03 08:24:11,Biomotive_info,"Incredible, in just 10 months habemus vaccine👇💪👌🥳   #insciencewetrust #sciencematters #COVID19 #CovidVaccine @BioNTech_Group @ERC_Research @EUScienceInnov https://t.co/y3HRWUPNGl",retweet,,insciencewetrust sciencematters covid19 covidvaccine,,,6,,,,fr,,,2,1.33404509887569e+18,zikaele,9.32594007489827e+17,<a href=,1008620033348720000,Mon Jun 18 07:58:49 +0000 2018,False,"The @BioMotive project, funded by #H2020 and #BBIJU, whose goal is to use biotechnology processes to create alternative solutions for the automotive industry.",4137,1125,1547,13,,Biomotive,1500,,http://biomotive.info,FALSE,8,2020-12-03,,,,,,,,"BioNTech_Group, ERC_Research, EUScienceInnov",CovidVaccine,,,,,,,,,,,,,,
508,1359504484708323328,https://twitter.com/BVirolle/status/1359504484708323328,Wed Feb 10 14:08:22 +0000 2021,2021-02-10 14:08:22,BVirolle,"Lu @canardenchaine : #Sanofi va supprimer 364 postes (-45 % en 12 ans), a gagné 1,5 md impôt-recherche en 10 ans. Ses bénéfices ? 12 mds (+340% en un an). Pourquoi ? le groupe a raflé des mds en vendant ses actions dans #Regeneron qui préparait un traitement contre... le COVID.",retweet,,sanofi regeneron,,,284,,,,fr,,,248,1.35949882317389e+18,IrigoyenWilliam,2790393991.0,<a href=,2554767229,Sun Jun 08 13:47:25 +0000 2014,False,,40,11,196,0,,raspoutine,1895,,,False,14,2021-02-10,#Regeneron,,,,,,bénéfices,Sanofi,,,,,,,,,,,,,,,
509,1422193935896743936,https://twitter.com/MamzelleMN/status/1422193935896743936,Mon Aug 02 13:53:52 +0000 2021,2021-08-02 13:53:52,MamzelleMN,Les marges sont déjà énormes (cf @oxfamfrance ) mais #Pfizer et #Moderna augmentent le #prix de leurs vaccins. Il faut lever les #brevets ! #ProfiteursDeLaCrise #LevéeDesBrevets  ▶ Source : https://t.co/opBqe3XDAa  ▶ Pour financer la lutte dessinée https://t.co/v6NlQeP3ew https://t.co/TNAGqZbBRV https://t.co/A6U9xt8Ep2,retweet,,pfizer moderna prix brevets profiteursdelacrise levéedesbrevets,,,971,,,,fr,,,510,1.4221385015046758e+18,AllanBARTE,537403611.0,<a href=,3295671660,Sun Jul 26 17:30:49 +0000 2015,False,"Curieuse, intéressée par la défense de l'environnement et autres élucubrations.Attachée au service public, cadre à la sécurité sociale dans une vie antérieure.",20002,90,126,2,"Saint-Brieuc, France",Mam'zelle MN,3329,,,FALSE,13,2021-08-02,,,"Pfizer, Moderna",,,,,,,,,,,,,,,,,,,,
510,1431064072125046786,https://twitter.com/fabiennelabarou/status/1431064072125046786,Fri Aug 27 01:20:37 +0000 2021,2021-08-27 01:20:37,fabiennelabarou,Australie🇦🇺: Un journaliste qui poussait à la vaccination regrette après l'injection du Pfizer qui lui a valu une inflation du cœur:,retweet,,,,,1275,,,,fr,,,1021,1.4309689453523515e+18,patrick_edery,7.894201037879583e+17,<a href=,385869391,Thu Oct 06 08:35:34 +0000 2011,False,Qui ne dit rien consent . Amour inconditionnel des animaux. Déteste la masse. Révoltée de naissance.,70829,897,669,3,Paris  & Correze,Fabienne . CARPE DIEM,60069,,,FALSE,1,2021-08-27,,,Pfizer,,,,,,,,,,,,,,,,,,,,
511,1380313796493799425,https://twitter.com/makoto_au_japon/status/1380313796493799425,Fri Apr 09 00:17:08 +0000 2021,2021-04-09 00:17:08,makoto_au_japon,Coronavirus : lUnion africaine renonce à lacquisition du vaccin AstraZeneca https://t.co/lCdaKo9F6h,retweet,,,,https://actucameroun.com/2021/04/08/coronavirus-lunion-africaine-renonce-a-lacquisition-du-vaccin-astrazeneca/,2,,,,fr,,False,1,1.3802333062817587e+18,actucameroun,4909374243.0,<a href=,25927619,Mon Mar 23 01:40:03 +0000 2009,False,"Tweet & RT ? Agree | ? #Japon #Japan #Urgence #Emergency | ?? pas bien français, ?? & Eng ?? | ?? #cane ?? ? ?: #infodemic",4391,2297,1249,263,#Japan or #Genève #Geneva ??,makotoinfodemic,116583,,,False,0,2021-04-09,AstraZeneca,,,,,,,lUnion africaine,,,,,,,,,,,,,,,
512,1401809075101446145,https://twitter.com/ChronodoseLyon/status/1401809075101446145,Mon Jun 07 07:51:42 +0000 2021,2021-06-07 07:51:42,ChronodoseLyon,"6 créneaux disponibles ? Demain à 15:20 ? Centre de vaccination Covid - Hôpital de Beaujeu (Pfizer-BioNTech) ? https://t.co/LueeZbfbHO ? 263 Avenue Dr Giraud, 69430 Beau https://t.co/RTgPVuX3Kk",original,,,https://pbs.twimg.com/media/E3Q564DX0AQpC_y.png,https://www.doctolib.fr/vaccination-covid-19/belleville-en-beaujolais/centre-de-vaccination-covid-belleville?pid=practice-165352,0,,,,fr,,False,0,,,,<a href=,1392209100751126529,Tue May 11 20:05:26 +0000 2021,False,"Activez la cloche pour être prévenu dès quune chronodose de vaccins est dispo sur Lyon, en se basant sur @vitemadose_off - by @plhery - hosted by @mikescops",9,78,6,2,,Chronodose Lyon,2613,,https://vitemadose.covidtracker.fr/centres-vaccination-covid-dpt69-rhone/recherche-standard,False,7,2021-06-07,,,Pfizer-BioNTech,,,,,Centre de vaccination Covid - Hôpital de Beaujeu,,,,,,,,,,,,,,,
513,1430176377672712196,https://twitter.com/Samsanspass/status/1430176377672712196,Tue Aug 24 14:33:14 +0000 2021,2021-08-24 14:33:14,Samsanspass,"Contrairement à bon nombre de compagnies, voici à priori une liste n'obligeant pas leurs salariés à se faire vacciner :   1. La Maison Blanche  2. Le CDC  3. FDA  4. L'OMS  5. Moderna  6. Pfizer  7. Johnson &amp; Johnson   Qui confirme ou dément ?",retweet,,,,,98,,,,fr,,,69,1.430173701622927e+18,gDesFaits,1.3071582395959747e+18,<a href=,1380534373796184088,Fri Apr 09 14:53:48 +0000 2021,False,,3828,49,132,0,,Sam,1500,,,FALSE,14,2021-08-24,,,"Moderna, Pfizer, Johnson &amp; Johnson",,,,,"La Maison Blanche, CDC, FDA, OMS",,,,,,,,,,,,,,,
514,1465034994603147271,https://twitter.com/PascalTolmer/status/1465034994603147271,Sun Nov 28 19:08:56 +0000 2021,2021-11-28 19:08:56,PascalTolmer,"Moderna va sortir un vaccin pour le nouveau variant. La prise sera naturellement obligatoire sous menace de perte de droits fondamentaux (voyage, travail, acces aux soins... etc). Ils ont une clientelle otage et zero risques. Le business model parfait.",retweet,,,,,1839,,,,fr,,,745,1.464690720934146e+18,AldoSterone111,320275643.0,<a href=,3207827751,Sun Apr 26 10:52:53 +0000 2015,False,Je milite pour la paix des êtres sur notre planète,27036,1405,3628,0,,pascalou,43450,,,FALSE,19,2021-11-28,,,Moderna,,zero risques,,,,,,,,,,,,,,,,,,
515,1457942570512814083,https://twitter.com/LouiseNalieva/status/1457942570512814083,Tue Nov 09 05:26:10 +0000 2021,2021-11-09 05:26:10,LouiseNalieva,"🔘 Nouvel Article | 08 Nov 2021 #KyleWarner, cycliste professionnel, atteint de péricardite, de syndrome de tachycardie et d’arthrite après l’injection #Pfizer ! Encore un athlète de haut niveau dont le cœur a été abîmé par la vaccination expérimentale anti covid-19 ! 👎 https://t.co/KebGmQqW6g",retweet,,kylewarner pfizer,,,15,,,,fr,,,17,1.4578578456937551e+18,Maya29854628,1.3462132500531323e+18,<a href=,1219132786860314625,Mon Jan 20 05:41:30 +0000 2020,False,,76839,1249,4998,0,,Louise Nalieva,45405,,,FALSE,5,2021-11-09,,,,,,,,Pfizer,,,,,,,,,,,,,,,
516,1375553722957316103,https://twitter.com/FKukulu/status/1375553722957316103,Fri Mar 26 21:02:18 +0000 2021,2021-03-26 21:02:18,FKukulu,Coronavirus : L'Agence du médicament confirme un risque de thrombose rare associé au vaccin AstraZeneca https://t.co/3ebdpRQe1a,retweet,,,,https://www.cnews.fr/monde/2021-03-26/direct-coronavirus-lagence-du-medicament-confirme-un-risque-de-thrombose-rare,257,,,,fr,,False,285,1.3755476002297935e+18,CNEWS,18396319.0,<a href=,2901121841,Mon Dec 01 19:47:03 +0000 2014,False,,5919,74,259,2,,Fk,2322,,,False,21,2021-03-26,AstraZeneca,,,,,,,Agence du médicament,,,,,,,,,,,,,,,
517,1457716082093985802,https://twitter.com/efficience422/status/1457716082093985802,Mon Nov 08 14:26:11 +0000 2021,2021-11-08 14:26:11,efficience422,🚨 P.Praud et M.Blachier sur CNews :  M.B : On le sait la #vaccination ne protège pas contre le nombre de cas.. P.P : Quand on est vacciné on transmet le virus ?  M.B : Tout à fait..  P.P : Excusez moi mais à mes yeux c'est terrible #3emedose #Vaccin #COVID19  #Macron20h #Pfizer https://t.co/4i2nSYlkUM,retweet,,vaccination 3emedose vaccin covid19 macron20h pfizer,,,21,,,,fr,,,21,1.457709898939224e+18,FaitIndesirable,1.4364568607695626e+18,<a href=,855470740325502977,Fri Apr 21 17:18:13 +0000 2017,False,#Think while it's still legal/  #LGBT 👻#NonALaVaccinationObligatoire #SansMacron2022,6801,162,546,1,,efficience,5107,,,FALSE,14,2021-11-08,3emedose,,Pfizer,,,,,,,,,,,,,,,,,,,,
518,1424652161372278785,https://twitter.com/SolideFrancais/status/1424652161372278785,Mon Aug 09 08:41:58 +0000 2021,2021-08-09 08:41:58,SolideFrancais,Les chaînes vont-elles également donner la parole aux victimes des effets secondaires graves de Pfizer et Moderna ?   Jusqu’à présent tout est fait pour les rendre invisibles. https://t.co/KDpiCX7Z7K,retweet,,,,,1204,,,,fr,,,520,1.424648953505661e+18,Poulin2012,474073938.0,<a href=,1392002706995351555,Tue May 11 06:25:01 +0000 2021,False,Votre vraie liberté commence lorsque vous pouvez choisir entre deux choses. https://t.co/utgE3XtedT,6358,119,202,0,France,FrancaisSolide 🇫🇷,6873,,,FALSE,8,2021-08-09,,,"Pfizer, Moderna",effets secondaires graves,,,,,,,,,,,,,,,,,,,
519,1379446318691667971,https://twitter.com/LESPRESSS/status/1379446318691667971,Tue Apr 06 14:50:05 +0000 2021,2021-04-06 14:50:05,LESPRESSS,#vaccin #AstraZeneca : La #presse complotiste s'acharne https://t.co/Qdb6MugXik,quote,,vaccin astrazeneca presse,,https://twitter.com/leJDD/status/1379411246332661764,5,,,,fr,,False,5,1.3794112463326615e+18,leJDD,49678509.0,<a href=,880090852365930496,Wed Jun 28 15:49:45 +0000 2017,False,"?? ?? ?? Infos parfois approximatives ou inexactes, rédigées par des ex-journalistes stagiaires virés de chez #BFMTV, #Cnews ou #LCI.",7398,7984,24,31,Canulars et parodies des fois,L'Expresss,11981,,,False,14,2021-04-06,,,AstraZeneca,,,,,,,,,,,,,,,,,,,,
520,1348192711980048389,https://twitter.com/chticycliste/status/1348192711980048389,Sun Jan 10 08:59:25 +0000 2021,2021-01-10 08:59:25,chticycliste,"Ceci n'est qu'un rappel vu les fake news qui continuent de fleurir sur le sujet. Efficace contre les Covid graves, le vaccin de Moderna le serait aussi contre la contagion | via @heidi_news https://t.co/BAakgnNS4x",retweet,,,,,657,,,,fr,,,254,1.3481725271227105e+18,axelkahn,514602810.0,<a href=,64417837,Mon Aug 10 14:36:30 +0000 2009,False,"Physiotherapist,Mulligan, McKenzie, neurology, sports and physical trainer, evidence based practice, sub8h30 triathlete...",3683,315,698,13,"Lille , France",Antoine,2189,,http://www.chticycliste.blogspot.com,False,8,2021-01-10,,,Moderna,,,,,,,,,,,,,,,,,,,,
521,1396746231892807695,https://twitter.com/Rcema2/status/1396746231892807695,Mon May 24 08:33:46 +0000 2021,2021-05-24 08:33:46,Rcema2,"Stephanie Dubois, jeune mannequin RMG Model Agency dans le coma après le vaccin Astra Zeneca Elle est actuellement hospitalisée et dans le coma après une hémorragie cérébrale. Son état serait une réaction au vaccin Covid Astra Zeneca. https://t.co/dwH3FuV5Zu",retweet,,,,,683,,,,fr,,,681,1.3964047086722499e+18,xazalbert,253486067.0,<a href=,1311219830087987206,Wed Sep 30 08:23:26 +0000 2020,False,,6453,30,103,0,,Rc ema,3287,,,False,8,2021-05-24,,,,,,,,RMG Model Agency,"Astra Zeneca, Astra Zeneca",,,,,,,,,,,,,,
522,1378363382076747777,https://twitter.com/Lily_Cara_G/status/1378363382076747777,Sat Apr 03 15:06:53 +0000 2021,2021-04-03 15:06:53,Lily_Cara_G,Le vaccin contre le coronavirus de Pfizer a tué 40 fois plus de personnes âgées que le virus lui-même https://t.co/EfSq5rlotd via @cogiitocom,retweet,,,,,170,,,,fr,,,156,1.3783398928795812e+18,MohamedTahiri_,1505526834.0,<a href=,3706017675,Sat Sep 19 10:19:41 +0000 2015,False,,14214,36,115,0,France,Lily,6686,,,False,15,2021-04-03,,,Pfizer,,,,,,Le vaccin contre le coronavirus,,,,,,,,,personnes âgées,,,,,
523,1396413900946563074,https://twitter.com/hpny2022/status/1396413900946563074,Sun May 23 10:33:12 +0000 2021,2021-05-23 10:33:12,hpny2022,"Covid-19 : le vaccin Moderna immunise entre 1 à 3 ans, estime son PDG https://t.co/1pocnGQnyE",retweet,,,,https://www.lepoint.fr/sante/covid-19-le-vaccin-moderna-immunise-entre-1-a-3-ans-estime-son-pdg-23-05-2021-2427691_40.php?utm_term=Autofeed&utm_medium=Social&utm_source=Twitter&Echobox=1621759975#xtor=CS1-32-%5BEchobox%5D,17,,,,fr,,False,10,1.3963999665711473e+18,LePoint,8460572.0,<a href=,1345704634111954945,Sun Jan 03 12:13:04 +0000 2021,False,scientifique sans trop de filtre au pays des communicants et autres baratineurs en carton.,8945,50,96,3,,HODL mais pas trop ^^,2579,,,False,10,2021-05-23,Moderna,,,,,,,PDG,,,,,,,,,,,,,,,
524,1338482504295182336,https://twitter.com/lautard65/status/1338482504295182336,Mon Dec 14 13:54:31 +0000 2020,2020-12-14 13:54:31,lautard65,Covid-19 : ce que l'on sait des effets secondaires des vaccins Pfizer et Moderna https://t.co/xD5bJEVumn,original,,,,https://www.lejdd.fr/Societe/ce-que-lon-sait-des-effets-secondaires-des-vaccins-pfizer-et-moderna-4010895,0,,,,fr,,False,0,,,,<a href=,901535478,Wed Oct 24 09:54:51 +0000 2012,False,compte de secours lautard7,86863,2748,1686,374,antillesGuadeloupe sxm,lautardcorinne,265853,,,FALSE,13,2020-12-14,,,"Pfizer, Moderna",effets secondaires,,,,,,,,,,,,,,,,,,,
525,1370085950542450694,https://twitter.com/pavraiment/status/1370085950542450694,Thu Mar 11 18:55:20 +0000 2021,2021-03-11 18:55:20,pavraiment,8 ÉTATS SUSPENDENT L'UTILISATION DU VACCIN ASTRAZENECA Ce sont ?? Danemark ?? Islande ?? Norvège ?? Autriche ?? Luxembourg ?? Estonie ?? Lituanie ?? Lettonie Il s'agit pour l'instant de suspensions temporaires dues à la survenue de thromboses et décès. https://t.co/HXUiOSID0u,retweet,,,,,1310,,,,fr,,,982,1.3700420895227904e+18,UPR_Asselineau,200659061.0,<a href=,1067797963148324864,Wed Nov 28 15:10:47 +0000 2018,False,,6591,60,130,0,,Bénon Pavraiment,5160,,,False,18,2021-03-11,ASTRAZENECA,,,,,,,,,,,,,,,,,,,,,,
526,1463425291578130437,https://twitter.com/MereSimonLuc/status/1463425291578130437,Wed Nov 24 08:32:33 +0000 2021,2021-11-24 08:32:33,MereSimonLuc,"La carrière brisée de Stephanie,27ans, championne équestre,qui souffre de dommages au système nerveux l'empêchant de marcher &amp; d'une péricardite post-vax Pfizer! STOP AU MASSACRE‼️🤮 #jesuisunefaille #jensuisfier #DupondMoretti #gestesbarrieres #ggrmc  https://t.co/p8MhTT0zVo",retweet,,jesuisunefaille jensuisfier dupondmoretti gestesbarrieres ggrmc,,,26,,,,fr,,,27,1.463142391502844e+18,antoncrowleysm1,1.3862663371446804e+18,<a href=,866613272652525568,Mon May 22 11:14:39 +0000 2017,True,"Liberté, égalité et réconciliation.",2633,53,223,0,,Mère Simon Luc,6354,,,FALSE,8,2021-11-24,DupondMoretti,,,,,,,Pfizer,,,,,,,,,,,,,,,
527,1371813188346478595,https://twitter.com/MariestellPech/status/1371813188346478595,Tue Mar 16 13:18:45 +0000 2021,2021-03-16 13:18:45,MariestellPech,"Je voudrais remercier tous les JT et autre reportages anxiogènes sur l'Astra Zeneca, ils viennent de foutre en l'air 2 mois de pédagogie avec mes parents qui ne veulent plus se faire vacciner contre le covid 19, ENCORE MERCI à ces champions.",retweet,,,,,1522,,,,fr,,,241,1.3715526277927526e+18,Fraoui1983,1567849861.0,<a href=,53364119,Fri Jul 03 11:47:39 +0000 2009,False,Journaliste au service société/ éducation/enseignement sup/ au Figaro. https://t.co/y6yZSk5Hk1.,10597,11334,1955,301,Paris,Marie-Estelle Pech,17300,,,False,13,2021-03-16,,,Astra Zeneca,,,,,JT,,,,,,,,,,,,,,,
528,1447163518181154816,https://twitter.com/hemery_bernard/status/1447163518181154816,Sun Oct 10 11:34:04 +0000 2021,2021-10-10 11:34:04,hemery_bernard,"L’Islande suspend l’usage du vaccin #Moderna, car « risque d’inflammation cardiaque » ! Pour tous les âges ! Après la Suède, la Finlande et le Danemark pour les jeunes. En France on continue tranquillement de façon religieuse, ou on se pose et on arrête ? https://t.co/pYcrsZCnxd",retweet,,moderna,,,1803,,,,fr,,,866,1.4467824892766986e+18,f_philippot,472412809.0,<a href=,1415651719611097088,Thu Jul 15 12:37:45 +0000 2021,True,,2920,6,0,0,,Bernard Hemery,1206,,,FALSE,11,2021-10-10,Moderna,,,,,,,,,,,,,,,,,jeunes,,,,,
529,1361564509756944387,https://twitter.com/laurenceputih/status/1361564509756944387,Tue Feb 16 06:34:10 +0000 2021,2021-02-16 06:34:10,laurenceputih,@Drmartyufml #COVID19 #vaccin Donc #AstraZeneca pour les #soignants c'est une erreur mais pour les autres c'est bon ? ?? Pas très #éthique ....,reply,,covid19 vaccin astrazeneca soignants éthique,,,3,Drmartyufml,1.3615366608785572e+18,552494536.0,fr,,,0,,,,<a href=,2877010568,Sat Oct 25 16:06:31 +0000 2014,False,Pas de Biographie ma Vie est loin d'être finie ?? #SynergologueDeNainsDeJardin #TherapeuteDuBonheur,11757,246,1252,2,,laurence putih,14755,,,False,6,2021-02-16,,,AstraZeneca,,,,,,,,,,,,,,,,,,,,
530,1458337473810124800,https://twitter.com/RomyZucchet/status/1458337473810124800,Wed Nov 10 07:35:23 +0000 2021,2021-11-10 07:35:23,RomyZucchet,🔴 #COVID19 : le vaccin #Moderna désormais déconseillé pour les moins de 30 ans https://t.co/02cUSkOKKF,retweet,,covid19 moderna,,https://c.estrepublicain.fr/sante/2021/11/08/covid-19-le-vaccin-moderna-desormais-deconseille-pour-les-moins-de-30-ans,10,,,,fr,,False,15,1.4578119070800323e+18,lestrepublicain,85286475.0,<a href=,920667312642019329,Wed Oct 18 15:06:07 +0000 2017,False,✏ Journaliste • Directrice de publication @brillantemag • Ex M2 InfoCom @ujml • Ex digital influencer @gmc_media_com • Membre @prenonsla1,15628,578,4999,9,📩 DM ouverts,Romy ©,16835,,https://romyzucchet.wordpress.com,FALSE,7,2021-11-10,Moderna,,,,,,,,,,,,,,,,,moins de 30 ans,,,,,
