Unnamed: 0,id,tweet_url,created_at,parsed_created_at,user_screen_name,text,tweet_type,coordinates,hashtags,media,urls,favorite_count,in_reply_to_screen_name,in_reply_to_status_id,in_reply_to_user_id,lang,place,possibly_sensitive,retweet_count,retweet_or_quote_id,retweet_or_quote_screen_name,retweet_or_quote_user_id,source,user_id,user_created_at,user_default_profile_image,user_description,user_favourites_count,user_followers_count,user_friends_count,user_listed_count,user_location,user_name,user_statuses_count,user_time_zone,user_urls,user_verified,hour,date,vaccine name,product name,company name,side effects,risks,benefits,vaccine benefits,organization,vaccine type,regulatory status,clinical trial phase,vaccination campaign,adverse reaction,immunization rate,public health policy,vaccine efficacy,vaccine safety,population segment,marketing strategy,public opinion,government funding,regulatory decision,economic impact
731,1388254459986423808,https://twitter.com/n0passaran/status/1388254459986423808,Fri Apr 30 22:10:30 +0000 2021,2021-04-30 22:10:30,n0passaran,"Olivier Véran a annoncé vendredi 30 avril avoir «saisi» la Haute autorité de Santé (HAS) pour étudier la possibilité de permettre à tous les volontaires, quel que soit leur âge, de se faire vacciner à l'AstraZeneca en signant une décharge. https://t.co/1opj6nCr9V",retweet,,,,,202,,,,fr,,,277,1.388134910708392e+18,ZazooClx,591841419.0,<a href=,259528569,Wed Mar 02 02:39:30 +0000 2011,False,"Il ny a ni bon ni mauvais usage de la liberté dexpression,il nen existe quun usage insuffisant. R.Vaneigem. Tout Pouvoir est une conspiration permanente.",32032,8521,7390,160,La Pachamama,AbdalahGeronimoCohen ??,149503,,,False,22,2021-04-30,AstraZeneca,,,,,,,"Haute autorité de Santé, HAS",,,,,,,,,,"Olivier Véran, volontaires",,,,,
732,1350856465649721345,https://twitter.com/Do_____oD/status/1350856465649721345,Sun Jan 17 17:24:13 +0000 2021,2021-01-17 17:24:13,Do_____oD,"#Thread Après la Norvège, les premiers chiffres tombent aux US : 55 décès suspects aux États-Unis à la suite dune injection du vaccin à ARN de Pfizer ou de Moderna, selon un rapport soumis aux autorités fédérales. https://t.co/2pGLesua7r",retweet,,thread,,,617,,,,fr,,,635,1.350642200292565e+18,DocteurGonzo4,1.1611141947559526e+18,<a href=,753076435,Sun Aug 12 13:00:33 +0000 2012,False,Votez Mélenchon en 2022 ? https://t.co/Afe0Yf1ANi,4097,62,188,1,,Do?,2283,,,False,17,2021-01-17,,,"Pfizer, Moderna",,,,,,,,,,,,,,,,,,,autorités fédérales,
733,1462493272891445253,https://twitter.com/Sun_Moon_13/status/1462493272891445253,Sun Nov 21 18:49:02 +0000 2021,2021-11-21 18:49:02,Sun_Moon_13,La soupe est tellement meilleure entre amis ...  #BFMTV #CNEWS #LCI @andrebercoff @PascalPraud @DIVIZIO1 @ivanrioufol  #AntiPassSanitaire #PassSanitaire #COVID19  #Elections2022 #COVID #Zemmour2022 #coronavirus @ZemmourEric #ToutSaufMacron #Presidentielle2022 #Pfizergate https://t.co/kfvrf6DK1T,retweet,,bfmtv cnews lci antipasssanitaire passsanitaire covid19 elections2022 covid zemmour2022 coronavirus toutsaufmacron presidentielle2022 pfizergate,,,1,,,,fr,,,1,1.462493107904258e+18,Despeerad0s,358965253.0,<a href=,1068039158285819904,Thu Nov 29 07:09:13 +0000 2018,False,Founder of Evolve Enterprises Pvt Ltd | Founder of Evolve Travel & Tour Maldives | CFO & CS of Kara Construction Pvt Ltd.,2058,372,593,1,Maldives,Moon,27895,,http://www.evolvetravelmaldives.com,FALSE,18,2021-11-21,PassSanitaire,,,,,,,"BFMTV, CNEWS, LCI, DIVIZIO1, AntiPassSanitaire, Pfizergate",,,,"Elections2022, Presidentielle2022",,,,,,,,,,,
734,1464982576037310473,https://twitter.com/votons2017/status/1464982576037310473,Sun Nov 28 15:40:38 +0000 2021,2021-11-28 15:40:38,votons2017,@Flobga Sondage sur le variant #Omicron. Votez et RT le sondage pour plus de votants. merci.  https://t.co/74ZCr3pVzo  #Noussommesles6millions #NonAuPassSanitaire #pfizergate #MacronDegage #VeranDemission #Dictature #Omacron #TouchezPasAuxEnfants #ASSEPSG,reply,,omicron noussommesles6millions nonaupasssanitaire pfizergate macrondegage verandemission dictature omacron touchezpasauxenfants assepsg,,https://twitter.com/votons2017/status/1464862759628288003,0,Flobga,1.464691708554322e+18,4319652797.0,fr,,False,0,1.464862759628288e+18,votons2017,7.427731817826263e+17,<a href=,742773181782626306,Tue Jun 14 17:38:21 +0000 2016,False,https://t.co/5JqsYfLElI est un site de démocratie participative  pour donner votre avis sur les candidats aux présidentielles de 2022. #presidentielle2022,3296,1776,1859,16,France,Presidentielle 2022,8821,,https://france-presidentielle.fr/,FALSE,15,2021-11-28,Omicron,,,,,,,NonAuPassSanitaire,,,,,,,,,,,,,,,
735,1311781740394971136,https://twitter.com/MarieMarysienka/status/1311781740394971136,Thu Oct 01 21:35:13 +0000 2020,2020-10-01 21:35:13,MarieMarysienka,Le PDG de Pfizer repousse l'affirmation de Trump sur le calendrier de vaccination.  https://t.co/f0n2JQic9Q,original,,,,https://apnews.com/article/election-2020-virus-outbreak-donald-trump-business-elections-bba3859d8465c309311bb911af33780f?utm_campaign=SocialFlow&utm_medium=APHealthScience&utm_source=Twitter,1,,,,fr,,False,0,,,,"<a href=""https://mobile.twitter.com"" rel=""nofollow"">Twitter Web App</a>",248794070,Mon Feb 07 18:55:02 +0000 2011,False,Auteure . Fiche signalétique : Détails futiles sur ma petite personne. Oser c'est l'espérance qui prend vie !,29936,2364,1145,141,,Marysieńka,68259,,http://www.lemanoirdespoetes.fr/poemes-marie-jose-gaechter.php,FALSE,21,2020-10-01,,,Pfizer,,,,,Trump,,,,calendrier de vaccination,,,,,,,,,,,
736,1442807099004788738,https://twitter.com/GuiteraR/status/1442807099004788738,Tue Sep 28 11:03:13 +0000 2021,2021-09-28 11:03:13,GuiteraR,Pour quelles vraies raisons #Sanofi arrête le vaccin #ARN ???? https://t.co/ETirLkjIVa,retweet,,sanofi arn,,https://www.lemonde.fr/planete/article/2021/09/28/covid-19-sanofi-arrete-le-developpement-de-son-vaccin-a-arn-messager_6096260_3244.html,775,,,,fr,,False,500,1.4427558594493276e+18,YvesPDB,2365378849.0,<a href=,887616910644457473,Wed Jul 19 10:15:37 +0000 2017,False,,25331,285,161,1,"Conca, France",GUITERA Richard,35491,,,FALSE,11,2021-09-28,ARN,,,,,,,Sanofi,,,,,,,,,,,,,,,
737,1380413425793253377,https://twitter.com/1soumimaispas2/status/1380413425793253377,Fri Apr 09 06:53:02 +0000 2021,2021-04-09 06:53:02,1soumimaispas2,TEMOIGNAGE d'un médecin suisse - Ma grand-mère a fait un acrosyndrome majeur après vaccination AstraZeneca. On l'anticoagule. Pour l'instant elle a toujours ses doigts #COVID19,retweet,,covid19,,,265,,,,fr,,,174,1.3802862884363264e+18,Laissonslespre1,1.2442809313572086e+18,<a href=,857351391601414144,Wed Apr 26 21:51:15 +0000 2017,False,," mais par ceux qui les regardent sans rien faire"""""""""""""""""""""""""""""""""""""""""""""""""""""""""""""""" Albert Einstein.""""""""""""""""""""""""""""""""",59848,478,614,1,,Lana matricule 756 Asile pour Assange !,64864,,,6,2021-04-09,AstraZeneca,,,,,,,,,,,,,,,,,,,,,,
738,1387268330503897088,https://twitter.com/martinebusconi/status/1387268330503897088,Wed Apr 28 04:51:58 +0000 2021,2021-04-28 04:51:58,martinebusconi,"2 personnes sont mortes du Covid qq semaines après avoir reçu 2 doses de Pfizer. Selon LARS, elles avaient des comorbidités et une fragilité. Pourquoi en ce cas inciter les personnes fragiles à recevoir 1 vaccin censé protéger contre les formes graves? https://t.co/1WlUNmS3kW",retweet,,,,,249,,,,fr,,,168,1.386996574123856e+18,MoniquePlaza3,8.32272924727976e+17,<a href=,267917313,Thu Mar 17 20:11:15 +0000 2011,False,,20385,2359,4998,193,,Busconi Martine,167620,,,False,4,2021-04-28,,,Pfizer,,,,,LARS,,,,,,,,,comorbidités,"personnes, personnes fragiles",,,,,
739,1440079965047779334,https://twitter.com/Fabrice_Eulry/status/1440079965047779334,Mon Sep 20 22:26:33 +0000 2021,2021-09-20 22:26:33,Fabrice_Eulry,"#Fauci lance le top départ de la vaccination covid des enfants de moins de 12 ans : ça commencera fin octobre ! D’abord Pfizer puis Moderna précise-t-il. On va entrer dans le dur là, le très dur. Courage ça va chauffer ! ⤵️ https://t.co/ugO6AeV3is",retweet,,fauci,,,2046,,,,fr,,,1054,1.4400517277853614e+18,f_philippot,472412809.0,<a href=,1904960142,Wed Sep 25 18:07:31 +0000 2013,False,Concertiste et #Compositeur français #Piano #Chopin #blues #HistoiredeFrance #patrimoine Qlympia 2015 Avignon 2017 #DefendsTonEglise #Frexit,6074,1709,2624,100,France,Fabrice Eنlry,35337,,http://www.fabriceeulry.com,FALSE,22,2021-09-20,Fauci,,"Pfizer, Moderna",,,,,,,,,,,,,,,enfants de moins de 12 ans,,,,,
740,1406019664786960384,https://twitter.com/Susana48492503/status/1406019664786960384,Fri Jun 18 22:43:05 +0000 2021,2021-06-18 22:43:05,Susana48492503,"SINGAPOUR - Andrew Tan, PDG de Pee-Ka-Poo, a posté le décès de sa mère sur F4cebook, affirmant qu'elle était morte seulement 29h après injection PFIZER. Il appelle d'autres internautes à témoigner. #MortApresVaccination ? ?? @ADv_in21 @ComploTisss https://t.co/sfAKAhfdaq",retweet,,mortapresvaccination,,,148,,,,fr,,,137,1.4060111451320648e+18,NicolasPichot6,1.323747268013527e+18,<a href=,1345054962783547393,Fri Jan 01 17:11:20 +0000 2021,False,,42916,296,364,0,,Susana,24630,,,False,22,2021-06-18,PFIZER,,Pee-Ka-Poo,,,,,SINGAPOUR,,,,,,,,,,,,,,,
741,1418341053078425602,https://twitter.com/Talie_Tal/status/1418341053078425602,Thu Jul 22 22:43:53 +0000 2021,2021-07-22 22:43:53,Talie_Tal,"On s'intéresse au vaccin pfizer, et on se limite aux effets secondaires graves (parce qu'une petite fièvre et une douleur au bras, ça devrait aller non ?) Alors alors, rapport de l'ANSM du débuit juillet ! https://t.co/pIfDp1LfRu",retweet,,,,,125,,,,fr,,,8,1.4174327053950523e+18,Ivnbw1,1.3443059816317215e+18,<a href=,1303063494468788226,Mon Sep 07 20:12:17 +0000 2020,False,Job? Concilier l'humain et la performance. Cannoise expatriée en IDF. Maman de 2👨‍👦.Co-fondatrice collectif @Ecole_Oubliee.🔴Ecole en sécurité face au Covid,38702,541,1371,6,France,🚩 Talie_Tal,32122,,,FALSE,22,2021-07-22,pfizer,,,effets secondaires graves,,,,ANSM,,,,,,,,,,,,,,,
742,1451416533645807632,https://twitter.com/NadineBor/status/1451416533645807632,Fri Oct 22 05:14:02 +0000 2021,2021-10-22 05:14:02,NadineBor,"Bonjour @LeHuffPost. Merci d’éviter de publier des fake news. Ces résultats ne sont ni ceux d’une « étude » (mais les résultats non-peer reviewed d’un essai), ni ne sont « publiés » dans aucun journal. Ceci est un communiqué de Pfizer. Votre article est-il un publi-reportage ? https://t.co/kPxTzqt2ZE",retweet,,,,,1662,,,,fr,,,730,1.451211292757332e+18,MaxDelvallee,631664880.0,<a href=,806981420,Thu Sep 06 14:51:23 +0000 2012,False,https://t.co/d9vNT81Jed,1527,85,26,5,Saint Pierre Montlimart,Nadine Boré,1799,,,FALSE,5,2021-10-22,,,Pfizer,,,,,,,,,,,,,,,,,,,,
743,1440672774561800210,https://twitter.com/PkVeyz/status/1440672774561800210,Wed Sep 22 13:42:10 +0000 2021,2021-09-22 13:42:10,PkVeyz,"La solution proposée par la direction marketing Pfizer est que tout le monde soit vacciné 😅👇🏻 Pour éradiquer le virus, non,  la vaccination obligatoire ne sera d’aucun effet, on le voit régulière avec les échappements immunitaires, « breakthrough infections » https://t.co/c4haCW4MwJ",retweet,,,,,7,,,,fr,,,2,1.4406692968504727e+18,alpha_taury,1.2686509453380526e+18,<a href=,1248187241874313216,Thu Apr 09 09:53:40 +0000 2020,False,,39433,306,304,2,,Veyz,26770,,,FALSE,13,2021-09-22,,,Pfizer,,,,,,,,,"vaccination obligatoire, breakthrough infections",,,,,,,,,,,
744,1371486570247823360,https://twitter.com/Arya_trs/status/1371486570247823360,Mon Mar 15 15:40:53 +0000 2021,2021-03-15 15:40:53,Arya_trs,L'arnaquezeneca Il a fallu que l'Allemagne prenne la décision d'arrêter...Macron à suivie? #AstraZeneca https://t.co/U60aewYdX1,quote,,astrazeneca,,https://twitter.com/morandiniblog/status/1371482881135104006,0,,,,fr,,False,0,1.371482881135104e+18,morandiniblog,35287180.0,<a href=,550342778,Tue Apr 10 18:40:23 +0000 2012,False,Fais-moi lhumour .,1494,969,311,40,Sur TF1,??,62516,,https://www.instagram.com/Arya_trs/,False,15,2021-03-15,,,AstraZeneca,,,,,,,,,,,,,,,,,,,,
745,1374326492319080451,https://twitter.com/BrindeLaine/status/1374326492319080451,Tue Mar 23 11:45:44 +0000 2021,2021-03-23 11:45:44,BrindeLaine,"#AstraZeneca : enquête ouverte après le décès dun étudiant en médecine, à Nantes #PlaintesVaccinsCovid #NiBétailNiCobaye @DIVIZIO1 https://t.co/lt1ftxBi5o",retweet,,astrazeneca plaintesvaccinscovid nibétailnicobaye,,,330,,,,fr,,,246,1.3740992744646943e+18,AssoCovid,1.2505127126202819e+18,<a href=,973869732393865216,Wed Mar 14 10:33:32 +0000 2018,False,"Brin de Laine, aime les laines naturelles, les beaux tricots, les motifs irlandais et celtiques, les gros pulls tout doux ...",3870,27,74,0,"Poitou-Charentes, France",Brin de Laine,4357,,,False,11,2021-03-23,,,AstraZeneca,,,,,,,,,,,,,,,,,,,,
746,1462353169007222786,https://twitter.com/MimondoTv/status/1462353169007222786,Sun Nov 21 09:32:19 +0000 2021,2021-11-21 09:32:19,MimondoTv,Un véritable scandale...  #ScandalePfizer  #pfizergate  #Pfizer  #DictatureSanitaire  #PassSanitaire  #manifs20novembre  #NonAuPassDeLaHonte  #NonAuPassSanitaire  #NonAuVaccinObligatoire #Covid_19 #COVID19  #VaccineSideEffects @LCI @BFMTV @CNEWS https://t.co/YINTbEK2G4,retweet,,scandalepfizer pfizergate pfizer dictaturesanitaire passsanitaire manifs20novembre nonaupassdelahonte nonaupasssanitaire nonauvaccinobligatoire covid_19 covid19 vaccinesideeffects,,,2,,,,fr,,,3,1.462350309171286e+18,PhilippeGerbie7,1.4221425900493005e+18,<a href=,2358402818,Sun Feb 23 19:21:41 +0000 2014,False,"Descubre ciudades, restaurantes, planes cool y como cocinar platos fáciles, ideas para una tarde aburrida, y mucho más a través de mi canal de Youtube.",6239,131,399,2,madrid,Mimondo TV,4111,,https://www.youtube.com/mimondotv,FALSE,9,2021-11-21,"DictatureSanitaire, NonAuPassSanitaire",,"Pfizer, PassSanitaire",VaccineSideEffects,,,,"LCI, BFMTV, CNEWS",,,,,,,,,,,,,,,
747,1464963806816354308,https://twitter.com/AubBoq/status/1464963806816354308,Sun Nov 28 14:26:03 +0000 2021,2021-11-28 14:26:03,AubBoq,"Moderna va sortir un vaccin pour le nouveau variant. La prise sera naturellement obligatoire sous menace de perte de droits fondamentaux (voyage, travail, acces aux soins... etc). Ils ont une clientelle otage et zero risques. Le business model parfait.",retweet,,,,,1839,,,,fr,,,744,1.464690720934146e+18,AldoSterone111,320275643.0,<a href=,1125121786960588801,Sun May 05 19:35:12 +0000 2019,False,"Que viennent les jours heureux, que nous retrouvions le goût du bonheur avec Jean-Luc Mélenchon 2022. Vive la Constituante  #JusticePourSteve #melenchonvagagner",89673,2672,1397,13,,AB,80435,,,FALSE,14,2021-11-28,,,Moderna,,zero risques,,,,,,,,,,,,,,,,,,
748,1430636968610865162,https://twitter.com/SebConstans/status/1430636968610865162,Wed Aug 25 21:03:27 +0000 2021,2021-08-25 21:03:27,SebConstans,"Selon le PDG de Pfizer, un variant résistant aux vaccins va probablement émerger. Par un heureux hasard, ils s’apprêtent à commercialiser un traitement très cher. https://t.co/URKWuAiC6B",retweet,,,,,687,,,,fr,,,335,1.4305498058859643e+18,MaxDelvallee,631664880.0,<a href=,444580705,Fri Dec 23 12:06:40 +0000 2011,False,,15643,58,117,1,,sebastien constans,11794,,,FALSE,21,2021-08-25,variant résistant aux vaccins,,Pfizer,,,,,,,,,,,,,,,,,,,,
749,1433333854836862976,https://twitter.com/ubertifa/status/1433333854836862976,Thu Sep 02 07:39:55 +0000 2021,2021-09-02 07:39:55,ubertifa,"Un contact enseignant au primaire à été hospitalisé covid l'hiver dernier, puis il a quand même pris ses 2 💉 Pfizer pour avoir le pass. Il est obligé de porter un masque à l'école, même en classe, malgré qu'il soit aussi immunisé que possible. Les patients dirigent l'asile !",retweet,,,,,517,,,,fr,,,135,1.4330565466284603e+18,LobservateurLi1,1.1562040457045975e+18,<a href=,1060970346,Fri Jan 04 17:29:00 +0000 2013,False,Forzza Napoli,2695,50,146,0,,Il Napolitano,2135,,,FALSE,7,2021-09-02,,,Pfizer,,,,,primaire,,,,,,,,,,,,,,,
750,1337779520443707392,https://twitter.com/lefigaroabonnes/status/1337779520443707392,Sat Dec 12 15:21:07 +0000 2020,2020-12-12 15:21:07,lefigaroabonnes,🔒 LA VÉRIFICATION - Les résultats prometteurs des vaccins ARN de Pfizer ou Moderna laissent entrevoir une lumière au bout du tunnel. Mais à quelle échéance ? https://t.co/x8AoCMFDzP,original,,,,https://www.lefigaro.fr/sciences/covid-les-vaccins-vont-ils-nous-permettre-de-retrouver-une-vie-normale-20201211?utm_term=Autofeed&utm_campaign=premium_fid_articles-fermes_2019_organique&utm_content&utm_term=VWR19004&utm_medium=social&utm_source=Twitter#Echobox=1607785963,1,,,,fr,,False,1,,,,<a href=,1090243514229770000,Tue Jan 29 13:41:24 +0000 2019,False,"L'excellence de l'information, des débats et des opinions   📩 Envie de donner votre point de vue ou d'échanger sur un sujet, écrivez-nous à Abonnes@lefigaro.fr",338,4718,342,56,France,Le Figaro Abonnés 🗞,28450,,https://www.lefigaro.fr,FALSE,15,2020-12-12,,,"Pfizer, Moderna",,,,,,ARN,,,,,,,,,,,,,,
751,1345652094573809664,https://twitter.com/nouanidonguy/status/1345652094573809664,Sun Jan 03 08:43:55 +0000 2021,2021-01-03 08:43:55,nouanidonguy,Covid-19 : l'Inde autorise deux vaccins dont celui développé par AstraZeneca https://t.co/qE6WuWZhUn https://t.co/5ledlc5IVi,retweet,,,,https://f24.my/7DtE.t,72,,,,fr,,False,21,1.345643697560453e+18,France24_fr,25048816.0,<a href=,1192118618332356608,Wed Nov 06 16:37:41 +0000 2019,False,Art Director /creative Director / stylist /style Af. always fresh,22,2,66,0,Zhejiang,Nouanidonguy,28,,http://shopaf.com,False,8,2021-01-03,,,AstraZeneca,,,,,,,,,,,,,,,,,,,,
752,1419968433542909954,https://twitter.com/Maxmvx/status/1419968433542909954,Tue Jul 27 10:30:30 +0000 2021,2021-07-27 10:30:30,Maxmvx,"Cancers, sida... De nombreuses maladies mortelles bientôt éradiquées grâce à la génétique : #ARNm messager et #CRISPR Le futur de la médecine NBIC s'invente avec la crise sanitaire 🙏🧬 #vaccination #Covid #Pfizer #moderna #NBIC  https://t.co/7OAgZeXRAu",retweet,,arnm crispr vaccination covid pfizer moderna nbic,,,192,,,,fr,,,60,1.4181155987946086e+18,DavidAngevin,188886600.0,<a href=,239415549,Mon Jan 17 15:33:51 +0000 2011,False,Journaliste @France3 #Cotedazur. Passionné de #tech #economie #innovation #vin et #tourisme. Mes tweets n'engagent que moi. RT=\\= approbation!,44740,2437,3166,164,"Var, cote d’Azur, France ",Maxime Meuneveaux,26812,,https://www.instagram.com/Maxime_Meuneveaux/,FALSE,10,2021-07-27,"NBIC, moderna, NBIC",,Pfizer,,,,,,,,,,,,,,,,,,,,
753,1351792759783481349,https://twitter.com/reunionla1ere/status/1351792759783481349,Wed Jan 20 07:24:43 +0000 2021,2021-01-20 07:24:43,reunionla1ere,Covid-19 : pourquoi privilégier le vaccin Moderna au vaccin Pfizer pour les Outre-mer ? #lareunion https://t.co/04KNGhLqt5,original,,lareunion,,http://zpr.io/HQ3xU,2,,,,fr,,False,2,,,,<a href=,229375729,Wed Dec 22 07:21:46 +0000 2010,False,Radio - Télévision - Internet,115,22367,581,345,Ile de la Réunion,Réunion la 1ère,36351,,http://la1ere.re,False,7,2021-01-20,Moderna,,Pfizer,,,,,,,,,,,,,,,,,,,,
754,1375184860977958920,https://twitter.com/percher_michel/status/1375184860977958920,Thu Mar 25 20:36:35 +0000 2021,2021-03-25 20:36:35,percher_michel,Covid-19: la Californie demande larrêt temporaire des injections dun lot du vaccin Moderna en raison dun trop grand nombre deffets indésirables. Une enquête est ouverte https://t.co/vovYby1Raq,retweet,,,,,175,,,,fr,,,163,1.375097874468442e+18,LevyLoiseau,399251929.0,<a href=,1320817538725535744,Mon Oct 26 20:01:13 +0000 2020,False,REBEL IN AN EVIL WORLD,4913,148,586,0,cosmos,Madfox Phoenhawks,5145,,,False,20,2021-03-25,Moderna,,,,,,,,,,,,,,,,,,,,,,
755,1349235092472950786,https://twitter.com/aslecat/status/1349235092472950786,Wed Jan 13 06:01:28 +0000 2021,2021-01-13 06:01:28,aslecat,"Un fake circule concernant les vaccins à ARNm Pfizer et Moderna : non, ils ne contiennent pas de",retweet,,,,,594,,,,fr,,,176,1.349014859120337e+18,DEFAKATOR_Off,8.689393986242724e+17,<a href=,617754838,Mon Jun 25 04:02:44 +0000 2012,False,,2847,10,101,0,"Paris, France",Tata Soso,239,,,False,6,2021-01-13,,,"Pfizer, Moderna",,,,,,,,,,,,,,,,,,,,
756,1456562387293777921,https://twitter.com/jcd92410/status/1456562387293777921,Fri Nov 05 10:01:49 +0000 2021,2021-11-05 10:01:49,jcd92410,RT si tu veux que les grands médias parlent enfin du #Pfizergate et arrêtent de faire l’autruche!😡 https://t.co/6TsBA73nLs,retweet,,pfizergate,,,1361,,,,fr,,,1733,1.4563294435516823e+18,EnModeMacaron,8.937588542945894e+17,<a href=,104757952,Thu Jan 14 08:58:39 +0000 2010,False,,5081,358,263,13,France,jc dauphin,30820,,,FALSE,10,2021-11-05,,,,,,,,RT,,,,,,,,,,,,,,,
757,1326819744784199682,https://twitter.com/roxanemlp/status/1326819744784199682,Thu Nov 12 09:30:52 +0000 2020,2020-11-12 09:30:52,roxanemlp,Vaccin Pfizer Elle est pas belle l’arnaque 👌🏻!non seulement vaccin inutile puisse que virus mute (voir video Pr Raoult et Dr Fouche à ce sujet) puis impossible car ce vaccin nécessite garder à -60o degre donc pas possible pour MG et personne ! Et ça 👇🏻😡😬 https://t.co/xudjWkbTTT,retweet,,,,,113,,,,fr,,,56,1.326799279399334e+18,kte06kte,403328789.0,"<a href=""https://mobile.twitter.com"" rel=""nofollow"">Twitter Web App</a>",555118102,Mon Apr 16 13:17:12 +0000 2012,True,,205534,1369,576,234,,meunier marie louise,373582,,,FALSE,9,2020-11-12,,,Pfizer,,,,,,"Vaccin, vaccin",,,,,,,,,,,,,,
758,1380424776255209472,https://twitter.com/cefestellita1/status/1380424776255209472,Fri Apr 09 07:38:08 +0000 2021,2021-04-09 07:38:08,cefestellita1,"Les moins de 55 ans qui ont reçu une première dose d'AstraZeneca contre le Covid-19 devraient avoir leur deuxième dose avec un autre vaccin, a déclaré @olivierveran. https://t.co/g3FTE6F1h0",retweet,,,,,11,,,,fr,,,13,1.380415985119867e+18,LePoint,8460572.0,<a href=,746366878768074752,Fri Jun 24 15:38:25 +0000 2016,False,,104958,514,2975,2,,Carlos EstellitaLins,87150,,,False,7,2021-04-09,,,AstraZeneca,,,,,,,,,,,,,,,Les moins de 55 ans,,,,,
759,1430441809776418817,https://twitter.com/kramkram88/status/1430441809776418817,Wed Aug 25 08:07:58 +0000 2021,2021-08-25 08:07:58,kramkram88,"Les contrats signés entre Pfizer et les états pour le pseudo-vaccin Covid rendu publique.Commande Brésil:100 millions de doses à 10€ l’unité..coût de revient 1,5€. Commande UE:1,8 milliards de doses à 30€ la pièce, faites vos calculs..le casse du siècle.. c’est nous qui payons",retweet,,,,,1329,,,,fr,,,829,1.4304263308066035e+18,LCamerado,1.1133848116017684e+18,<a href=,2847091954,Mon Oct 27 18:18:05 +0000 2014,False,,29182,493,517,6,vosges,kram,59733,,,FALSE,8,2021-08-25,,,Pfizer,,,,,,,,,"Commande Brésil, Commande UE",,,,,,,,,,,
760,1359245554245636099,https://twitter.com/LyonMarlowSanFr/status/1359245554245636099,Tue Feb 09 20:59:28 +0000 2021,2021-02-09 20:59:28,LyonMarlowSanFr,"Sur les 1906 morts Covid du 20 décembre au 5 février qu'a enregistré Israël, 550 avaient reçu une dose Pfizer, ou les deux. Soit 28,9% de",retweet,,,,,496,,,,fr,,,336,1.3591628715114496e+18,LaureGonlezamar,1.2858676363337073e+18,<a href=,3237220711,Fri Jun 05 17:56:14 +0000 2015,True,Stopping humans from being human will not stop the virus from being a virus!,7379,109,615,1,,LyonMarlowSF,8012,,,False,20,2021-02-09,,,Pfizer,,,,,,,,,,,,,,,,,,,,
761,1358462324802224131,https://twitter.com/marineha29/status/1358462324802224131,Sun Feb 07 17:07:11 +0000 2021,2021-02-07 17:07:11,marineha29,Lagence du médicament indienne demande des informations complémentaires à Pfizer sur son #vaccin -&gt; Pfizer retire sa demande denregistrement https://t.co/x2r915e1NX #COVID19 #COVID #CovidVaccine #vaccination #Covid_19,retweet,,vaccin covid19 covid covidvaccine vaccination covid_19,,,708,,,,fr,,,440,1.3581657931172536e+18,Laissonslespre1,1.2442809313572086e+18,<a href=,499733920,Wed Feb 22 12:25:30 +0000 2012,False,,3284,26,35,0,France,Marie Renée H,3142,,http://blograinbowdreamer.wordpress.com,False,17,2021-02-07,CovidVaccine,,"Pfizer, Pfizer",,,,,Lagence du médicament indienne,,,,,,,,,,,,,,,
762,1402923452814737410,https://twitter.com/paola_nocilla/status/1402923452814737410,Thu Jun 10 09:39:50 +0000 2021,2021-06-10 09:39:50,paola_nocilla,"Le lien entre vaccination #Pfizer ou #Moderna et myocardites pour les jeunes se précise. Au début, c'était du complotisme. Puis ce fut admis comme possible pour les 16-24 ans. Maintenant, c'est probable pour les 16-30 ans. Mais ça reste bénin, bien sûr. https://t.co/hsLNaoNsIJ https://t.co/b9BdBUJHoE",retweet,,pfizer moderna,,,770,,,,fr,,,537,1.4029164131285197e+18,UPR_Asselineau,200659061.0,<a href=,1265415900582359043,Tue May 26 22:54:10 +0000 2020,False,Je hais l'injustice ! Anti vaccin. J'aime la photo (amateur) ? Anti pass sanitaire.,37259,530,555,4,Belgique ( Liège),?? Paola ??,16824,,,False,9,2021-06-10,Moderna,,Pfizer,,,,,,,,,,,,,,,jeunes,,,,,
763,1430399927486648326,https://twitter.com/VanakerJ/status/1430399927486648326,Wed Aug 25 05:21:32 +0000 2021,2021-08-25 05:21:32,VanakerJ,"Covid-19. Ce que l'on sait du vaccin Valneva, en passe d'être autorisé au Royaume-Uni - https://t.co/rdFbDOYGuL",original,,,,https://www.vosgesmatin.fr/sante/2021/08/24/ce-que-l-on-sait-du-vaccin-valneva-peut-etre-bientot-disponible-au-royaume-uni?utm_medium=Social&utm_source=Facebook&fbclid=IwAR176AEHCyofarDxNv8f3KS8vBTyEdKAeP3WC9BDV1ABenTLAYps0cZAUyU#Echobox=1629796312,0,,,,fr,,False,0,,,,<a href=,1334904465179152385,Fri Dec 04 16:57:20 +0000 2020,False,grande gueule sans langue de bois,0,0,8,0,,vanaker jacky,278,,,FALSE,5,2021-08-25,Valneva,,,,,,,,,,,,,,,,,,,,,,
