Unnamed: 0,id,tweet_url,created_at,parsed_created_at,user_screen_name,text,tweet_type,coordinates,hashtags,media,urls,favorite_count,in_reply_to_screen_name,in_reply_to_status_id,in_reply_to_user_id,lang,place,possibly_sensitive,retweet_count,retweet_or_quote_id,retweet_or_quote_screen_name,retweet_or_quote_user_id,source,user_id,user_created_at,user_default_profile_image,user_description,user_favourites_count,user_followers_count,user_friends_count,user_listed_count,user_location,user_name,user_statuses_count,user_time_zone,user_urls,user_verified,hour,date,vaccine name,product name,company name,side effects,risks,benefits,vaccine benefits,organization,vaccine type,regulatory status,clinical trial phase,vaccination campaign,adverse reaction,immunization rate,public health policy,vaccine efficacy,vaccine safety,population segment,marketing strategy,public opinion,government funding,regulatory decision,economic impact
266,1348542239111262213,https://twitter.com/Coronis1Coronis/status/1348542239111262213,Mon Jan 11 08:08:19 +0000 2021,2021-01-11 08:08:19,Coronis1Coronis,La RevueDePresse Internationale spéciale #COVID19 est à jour ce lundi matin à 6h11 sur https://t.co/9kSzm3fTMc avec un spécial #vaccins #moderna #AstraZeneca #SpoutnikV #pfizer et #sinopharm + l'avis d'un médecin au-dessus c'est le soleil L'ECO dispo mardi ?? à tous &amp; toutes https://t.co/1llR7Y5XUV,retweet,,covid19 vaccins moderna astrazeneca spoutnikv pfizer sinopharm,,http://quotidien.com,721,,,,fr,,False,368,1.348502351020175e+18,pierrejovanovic,205414077.0,<a href=,4835136977,Fri Jan 22 13:13:29 +0000 2016,False,"je passe l'info , faites en ce que vous voulez. révoltée parfois par ce que je lis , je ne peux m'empêcher de réagir .",55260,843,860,3,"Rhône-Alpes, France",Coronis,108238,,,False,8,2021-01-11,SpoutnikV,,"moderna, AstraZeneca, pfizer, sinopharm",,,,,,,,,,,,,,,,,,,,
267,1411028760883875840,https://twitter.com/lecorbonoir/status/1411028760883875840,Fri Jul 02 18:27:26 +0000 2021,2021-07-02 18:27:26,lecorbonoir,"Responsable mais pas coupable ? Landes : la plainte déposée par la famille d'un retraité, mort après un vaccin Pfizer, classée sans suite… https://t.co/3B4dUqjjUv",retweet,,,,,444,,,,fr,,,545,1.4108893218975127e+18,Krieger66362259,8.120438474339164e+17,<a href=,2280871022,Tue Jan 07 16:47:04 +0000 2014,False,Humain de 40 ans.L'indifférence est un,7942,1298,726,155,,jean-michel Bhor,224565,,,FALSE,18,2021-07-02,,,Pfizer,,,,,,,,,,,,,,,,,,,,
268,1336743211277152257,https://twitter.com/lankkou1/status/1336743211277152257,Wed Dec 09 18:43:11 +0000 2020,2020-12-09 18:43:11,lankkou1,UK : la BBC sort un article dans la pure tradition antivaxxer pour le vaccin Covid... Russe ! Pourtant 100% de leurs propos s'appliquent aussi au Pfizer https://t.co/MCAQO5z7Ah,retweet,,,,,61,,,,fr,,,17,1.33673587028047e+18,AldoSterone111,320275643.0,<a href=,4209673155,Tue Nov 17 12:37:42 +0000 2015,False,10JTAL  SLDT,19842,344,565,2,,LANKKOU,53346,,,FALSE,18,2020-12-09,antivaxxer,,,,,,,"BBC, Pfizer",,,,,,,,,,,,,,,
269,1404452053238308868,https://twitter.com/covidplus1/status/1404452053238308868,Mon Jun 14 14:53:57 +0000 2021,2021-06-14 14:53:57,covidplus1,"Le laboratoire #Novavax affirme que son #vaccin anti-Covid est efficace à plus de 90%, y compris contre les variants. Il se base sur une étude réalisée sur près de 30.000 personnes aux Etats-Unis et au Mexique. https://t.co/erSa7gtpoI",original,,novavax vaccin,https://pbs.twimg.com/media/E32dlsbXMAEBL7z.jpg,,0,,,,fr,,False,0,,,,<a href=,1351475267458523136,Tue Jan 19 10:24:05 +0000 2021,False,"Toute l'info positive autour du #coronavirus. Pour 1 #vaccination massive, rapide #Covid19 #Vaccin #BonneNouvelle #Covid #JeSuisVacciné #Science No #fakemed",3361,105,389,1,France,Covid+ Toutes les infos positives ?? vacciné,3073,,,False,14,2021-06-14,,,,,,,,"Le laboratoire, Novavax",,,,,,,,,,près de 30.000 personnes,,,,,
270,1387189402280017921,https://twitter.com/al_bendy/status/1387189402280017921,Tue Apr 27 23:38:20 +0000 2021,2021-04-27 23:38:20,al_bendy,"Explications trop tardives pour beaucoup... Ne souhaitant surtout pas blesser, je ne nommerai personne mais mentionnerai notamment ces 2 personnes mortes à 53 et 68 ans...d'un #COVID19 qui suivait 2 doses de vaccin #Pfizer. Scénario répété CATASTROPHIQUE. https://t.co/NTmq1WcMEv",retweet,,covid19 pfizer,,,1651,,,,fr,,,1121,1.387160783717552e+18,CaudeHenrion,1.346890637690499e+18,<a href=,2766674464,Wed Sep 10 21:08:57 +0000 2014,False,Quelque chose de gros se prepare...quelque chose qui touchera le monde libre. #jenemereconfineraipas,4585,93,212,9,,Al Bendy,5101,,,False,23,2021-04-27,,,Pfizer,,,,,,,,,,,,,,,,,,,,
271,1456392830675521546,https://twitter.com/MThL22/status/1456392830675521546,Thu Nov 04 22:48:03 +0000 2021,2021-11-04 22:48:03,MThL22,"💥💉 #Pfizergate Nous ne laisserons pas passer ces révélations, nous lancerons tous les recours ⚖️ possibles pour faire la lumière sur ce scandale sans précédent ! Pfizer a menti Les gouvernements ont mentis C'est criminel! @autrement_votre @TheLEGALFound_ https://t.co/GxPcHDNl18",retweet,,pfizergate,,,1468,,,,fr,,,833,1.456048796262191e+18,AssoCovid,1.2505127126202819e+18,<a href=,4250824643,Sun Nov 22 16:30:01 +0000 2015,False,,33307,210,75,26,"Côtes-d'Armor, Bretagne",MT. Lefeuvre,79181,,,FALSE,22,2021-11-04,Pfizergate,,Pfizer,,,,,,,,,,,,,,,,,,,,
272,1380086848027000834,https://twitter.com/Carolinebharati/status/1380086848027000834,Thu Apr 08 09:15:20 +0000 2021,2021-04-08 09:15:20,Carolinebharati,Covid-19 : l'Europe reconnaît «des risques rares» de complications pour AstraZeneca https://t.co/b2krNQi8Ut,retweet,,,,https://www.lefigaro.fr/sciences/covid-19-l-europe-reconnait-des-risques-rares-de-complications-pour-astrazeneca-20210408?utm_source=app&utm_medium=sms&utm_campaign=fr.playsoft.lefigarov3,1,,,,fr,,False,4,1.3800854019778107e+18,Nandilaure,493170552.0,<a href=,490630286,Sun Feb 12 19:07:16 +0000 2012,False,Orpheline d'un vrai parti de droite.,76116,6436,1939,99,"Maisons-Laffitte, France",Caroline,229109,,,False,9,2021-04-08,,,AstraZeneca,,"risques rares, complications",,,,,,,,,,,,,,,,,,
273,1430002287955546113,https://twitter.com/RodoguneP/status/1430002287955546113,Tue Aug 24 03:01:28 +0000 2021,2021-08-24 03:01:28,RodoguneP,le ministre de la santé algérien accuse Pfizer de vouloir leur imposer un contrat inacceptable qu’il a été incapable de signer étant donné que Pfizer ne voulait prendre aucune responsabilité sur les effets indésirables ! @pierrejovanovic @Verhaeghe  https://t.co/pBK5Ls3MV7,retweet,,,,,1802,,,,fr,,,1262,1.4298664361058058e+18,gulftrotter1,1.224038534258004e+18,<a href=,1241051200017096707,Fri Mar 20 17:17:50 +0000 2020,False,,88397,453,177,1,USA,Rodogune Petipas,59814,,,FALSE,3,2021-08-24,,,"Pfizer, Pfizer",effets indésirables,,,,Verhaeghe,,,,,,,,,,,,,,,
274,1358530585271144453,https://twitter.com/ThomasRudelle/status/1358530585271144453,Sun Feb 07 21:38:26 +0000 2021,2021-02-07 21:38:26,ThomasRudelle,Des chercheurs israéliens estiment à 95% l'efficacité du vaccin Pfizer une semaine après la deuxième injection. Cette modélisation effectuée sur des données de vie réelle confirmerait donc les essais cliniques. L'étude n'a pas encore été publiée. https://t.co/PrVA3TB80r,retweet,,,,,217,,,,fr,,,74,1.3584557025456988e+18,vincentglad,1731311.0,<a href=,5856932,Tue May 08 08:10:33 +0000 2007,False,"Global Digital Marketing Director @groupecarrefour, intervenant @iscom @iscparisschool @licencecpmn",11307,6545,1825,629,"Paris, France",Thomas Rudelle,29625,,http://fr.linkedin.com/in/thomasrudelle,False,21,2021-02-07,,,Pfizer,,,,,,,,,,,95%,,efficacité,,,,,,,
275,1355170584800464899,https://twitter.com/UnbelievableAC/status/1355170584800464899,Fri Jan 29 15:06:59 +0000 2021,2021-01-29 15:06:59,UnbelievableAC,"Qui l'emportera de l'Union européenne ou du groupe AstraZeneca qui ne veut (ou ne peut) pas livrer aux 27 États membres toutes les doses de son vaccin contre le Covid-19? L'entreprise a déjà perdu la bataille de l'image, estime ce quotidien suisse. https://t.co/SzdfOkhMQA",retweet,,,,,11,,,,fr,,,10,1.3551695726645944e+18,courrierinter,83864876.0,<a href=,925723848624017408,Wed Nov 01 13:58:59 +0000 2017,False,L3 science politique - Université de Lille,8102,58,336,0,"Où il fait froid, France",chanandler bong,3476,,http://michto.com,False,15,2021-01-29,,,groupe AstraZeneca,,,,,Union européenne,,,,,,,,,,,,,,,
276,1359305867246653447,https://twitter.com/gigi8123/status/1359305867246653447,Wed Feb 10 00:59:08 +0000 2021,2021-02-10 00:59:08,gigi8123,#Coronavirus #Traitement #CORONAVIRUSFRANCE #Medecine ?? Alerte IMPORTANTE : DECOUVERTE TRAITEMENT ! par Oxford University ! Réduisant le risque d' Hospitalisation de 90 % ! Il s'agit d'un Stéroide par Inhalation : Budésonide de Astra Zeneca (pas le vaccin cette fois) https://t.co/HthqZES00Q,retweet,,coronavirus traitement coronavirusfrance medecine,,,40,,,,fr,,,35,1.3592196984083003e+18,HistoireSecrete,2313705762.0,<a href=,1087065967966994432,Sun Jan 20 19:14:58 +0000 2019,False,,35359,401,458,1,"Bretagne, France",GIGI8,34182,,,False,0,2021-02-10,"Budésonide, Astra Zeneca",,,,,,,Oxford University,,,,TRAITEMENT,,,,,,,,,,,
277,1345769782461665280,https://twitter.com/lefigarolaune/status/1345769782461665280,Sun Jan 03 16:31:33 +0000 2021,2021-01-03 16:31:33,lefigarolaune,Covid-19 : que faut-il savoir sur le très attendu vaccin AstraZeneca/Oxford ? https://t.co/U2ddyoowQx https://t.co/daTekzhjPf,original,,,https://pbs.twimg.com/media/Eq0ifFXVkAEqVap.jpg,http://dlvr.it/RpqcSm,0,,,,fr,,False,0,,,,<a href=,918777902937845760,Fri Oct 13 09:58:16 +0000 2017,True,,0,9,10,1,,Laune,6566,,,False,16,2021-01-03,Oxford,,AstraZeneca,,,,,,,,,,,,,,,,,,,,
278,1382108357344030721,https://twitter.com/handromak/status/1382108357344030721,Tue Apr 13 23:08:05 +0000 2021,2021-04-13 23:08:05,handromak,"Angleterre : 60113 décès Covid pour 2020. Début de la vaccination de masse le 8 décembre, on est à 135000 décès actuellement soit 75.000 décès en 4 mois de vaccination. Salvateurs les vaccins Pfizer et Astra Zeneca ? https://t.co/9Fb7FVlbph",retweet,,,,,977,,,,fr,,,775,1.381774751178371e+18,RaderSerge,9.057699866685481e+17,<a href=,109708498,Sat Jan 30 00:21:10 +0000 2010,False,Je plains ceux qui on lair intelligent; cest une promesse quon ne peut tenir.,22888,442,1011,64,Paris,Leli,39703,,,False,23,2021-04-13,,,"Pfizer, Astra Zeneca",,,,,,,,,vaccination de masse,,,,,,,,,,,
279,1457985261846114309,https://twitter.com/STEPHAN47009453/status/1457985261846114309,Tue Nov 09 08:15:49 +0000 2021,2021-11-09 08:15:49,STEPHAN47009453,Voici un Homme qui démontre cette situation scandaleux! et dénonce le système de la peur qu'ont est tous dedans !! #Pfizergate #passsanitaire #COVID19 https://t.co/a12UgwvX3D,retweet,,pfizergate passsanitaire covid19,,,2720,,,,fr,,,1750,1.45783388816896e+18,MagicDrix,1402765742.0,<a href=,722869960712843264,Wed Apr 20 19:30:03 +0000 2016,False,"Nationaliste - Anti #UE - Anti-mondialiste - Catholique Lecteur fidèle de #Rivarol  #Zemmour, non merci ✋",41340,412,867,0,"Joyeuse, Ardèche",Néanderthal,17218,,,FALSE,8,2021-11-09,passsanitaire,,Pfizergate,,,,,,,,,,,,,,,,,,,,
280,1350541297136840705,https://twitter.com/cimedudiable/status/1350541297136840705,Sat Jan 16 20:31:51 +0000 2021,2021-01-16 20:31:51,cimedudiable,@Guillaume_Bigot @CNEWS Presque 9 fois plus de chocs anaphylactiques avec le vaccin Pfizer qu'avec le vaccin pour la grippe https://t.co/kWuc3iik53,retweet,,,,,2,,,,fr,,,3,1.3504591155255788e+18,BisounoursPapy,1.3186272701442621e+18,<a href=,976911859373805568,Thu Mar 22 20:01:52 +0000 2018,False,Lyonnaise de naissance Niçoise d adoption Tout va bien pour moi mais par dessus tout je veux un monde juste,244353,2535,4988,7,Mougins,Cime du diable,147256,,,False,20,2021-01-16,,vaccin pour la grippe,Pfizer,,,,,,,,,,,,,,,,,,,,
281,1434185343910174726,https://twitter.com/PaulineBon3/status/1434185343910174726,Sat Sep 04 16:03:26 +0000 2021,2021-09-04 16:03:26,PaulineBon3,3/n Le gens ne devrait commencer à utiliser des médicaments ou des vaccins qu'en phase 4 d'essais cliniques. Pfizer nous dit ceci en phase 3: Les essais sur les animaux pour les vaccins contre les coronavirus ont systématiquement échoué car les animaux sont tombés malades/morts,retweet,,,,,265,,,,fr,,,176,1.4340869495187825e+18,Medic4allHuman,3184023196.0,<a href=,839574524211376131,Wed Mar 08 20:32:19 +0000 2017,False,"De #droitesociale, je ne supporte pas le #progressisme et son anarchie destructrice. Je suis sur parler, minds et gab  @paulinebon - obj : censurer les censeurs",81941,1013,1166,2,,Pauline Bon,97544,,,FALSE,16,2021-09-04,,,Pfizer,,,,,,,,"phase 4, essais cliniques, phase 3",,,,,,,gens,,,,,
282,1458904801853558787,https://twitter.com/claudiu93441668/status/1458904801853558787,Thu Nov 11 21:09:44 +0000 2021,2021-11-11 21:09:44,claudiu93441668,"Dr Raoult qui dénonce les conflits d intérêts de Bill Gates, les révélations #Pfizergate , Blachier qui rends public les très faible % de patients Covid dans les hôpitaux …#Macron20h suivi par moins de 20 Millions ça commence à sentir bon la victoire #11Novembre  #VeranEnPrison",retweet,,pfizergate macron20h 11novembre veranenprison,,,857,,,,fr,,,357,1.4587217469708943e+18,Arias67576160,1.085500247000916e+18,<a href=,1411321262446678022,Sat Jul 03 13:50:05 +0000 2021,False,peintre en batiment,1550,70,140,0,"Sherbrooke, Québec",claudius,3349,,,FALSE,21,2021-11-11,,,"Dr Raoult, Bill Gates, Pfizergate, Blachier",,,,,Macron20h,,,,,,,,,,,,,,,
283,1369738882825269257,https://twitter.com/ExcessMidnight/status/1369738882825269257,Wed Mar 10 19:56:12 +0000 2021,2021-03-10 19:56:12,ExcessMidnight,"@LeSeulIban @Inside_US4 Oui mais c'est le pic actuel mais il ya 2 mois c'était loin des 2 millions. Pour aller plus vite ils ont validé un troisième vaccin, le Janssen Covid-19.",reply,,,,,0,LeSeulIban,1.3697160931373548e+18,1.2268270561949573e+18,fr,,,0,,,,<a href=,1339874232545800192,Fri Dec 18 10:06:17 +0000 2020,False,Quand j'étais enfant je posais beaucoup de questions. Aujourd'hui je m'en pose toujours ...mais c'est devenu incorrect,6220,580,689,4,,Midnight Excess,10113,,,False,19,2021-03-10,Janssen Covid-19,,,,,,,,,,,,,,,,,,,,,,
284,1404408323600957442,https://twitter.com/m1ttywalter/status/1404408323600957442,Mon Jun 14 12:00:11 +0000 2021,2021-06-14 12:00:11,m1ttywalter,"Image choquante du petit Vincenzo, 8 mois, 1er bébé cobaye à avoir reçu deux doses du poison Pfizer? Ses parents, terrifiés par le Covid (admirez le double masque du père) pensent que le",retweet,,,,,301,,,,fr,,,249,1.404405016325206e+18,Yoann_IV,424224274.0,<a href=,1329300152746696704,Thu Nov 19 05:49:21 +0000 2020,False,,12127,148,231,2,,Bikkhu,8791,,,False,12,2021-06-14,,,Pfizer,,,,,,,,,,,,,,,,,,,,
285,1359989491973447680,https://twitter.com/Etdespoussieres/status/1359989491973447680,Thu Feb 11 22:15:36 +0000 2021,2021-02-11 22:15:36,Etdespoussieres,Les hôpitaux de Brest et Morlaix suspendent la vaccination AstraZeneca des soignants [Exclusif] - Coronavirus - Le Télégramme https://t.co/11N1loXJH5?,original,,,,https://www.letelegramme.fr/coronavirus/le-chru-de-brest-suspend-la-vaccination-astrazeneca-des-soignants-11-02-2021-12703395.php,1,,,,fr,,False,1,,,,<a href=,805416976399159296,Sun Dec 04 14:22:25 +0000 2016,False,Emerveillez-moi. Crois en la bonté du coeur de l'Homme. Histoire Société Politique Spiritualité,67814,4612,4865,32,,?? ?? ÉCL@IR ?,108706,,,False,22,2021-02-11,AstraZeneca,,,,,,,"Les hôpitaux de Brest et Morlaix, Le Télégramme",,,,,,,,,,,,,,,
286,1358115697725956099,https://twitter.com/V49196776/status/1358115697725956099,Sat Feb 06 18:09:49 +0000 2021,2021-02-06 18:09:49,V49196776,Pfizer/BioNtech retire sa demande dautorisation durgence du vaccin Covid-19 en Inde après que le régulateur indien a demandé plus de données et un essai clinique sur place au préalable. https://t.co/Bq4ZU4n4w9 https://t.co/cOWOB8CnO0,retweet,,,,,996,,,,fr,,,830,1.3580718160367534e+18,DocteurGonzo4,1.1611141947559526e+18,<a href=,1285949594635993090,Wed Jul 22 14:47:53 +0000 2020,False,,10803,38,155,0,,V,6786,,,False,18,2021-02-06,,,"Pfizer, BioNtech",,,,,,,régulateur indien,,,,,,,,,,,,,
287,1386658618150465537,https://twitter.com/DurierB/status/1386658618150465537,Mon Apr 26 12:29:12 +0000 2021,2021-04-26 12:29:12,DurierB,"#Marseille : #vacciné avec #Pfizer, un #couple qui se pensait",original,,marseille vacciné pfizer couple,,https://www.midilibre.fr/2021/04/26/marseille-vaccine-avec-pfizer-un-couple-qui-se-pensait-invincible-contamine-par-le-coronavirus-9510672.php,0,,,,fr,,False,0,,,,<a href=,1253301719896920067,Thu Apr 23 12:36:42 +0000 2020,False,"Gitano/Gypsy Hip Hop Old School and Techno Music... Música Ecléctica. No sexism, No racism, No classism, No speciesism, No... https://t.co/rzqb6YqRA0",30776,459,5001,1,Montpellier et ailleurs,Il n'y a point de génie sans un grain de folie.,36443,,https://www.paypal.com/paypalme/BenjaminDurier1234?locale.x=fr_FR,False,12,2021-04-26,,,Pfizer,,,,,,,,,,,,,,,,,,,,
288,1370023025190395904,https://twitter.com/InfoMatrice/status/1370023025190395904,Thu Mar 11 14:45:17 +0000 2021,2021-03-11 14:45:17,InfoMatrice,"Une femme de lUtah 39 ans en pleine santé meurt 4 J après la 2ème dose du vaccin Moderna, elle avait ressentie des prémices désagréables lors de la 1 ère: trés mal dans son bras, boire sans uriner. Lors de la 2nde des palpitations cardiaques lont alertée https://t.co/0LDTnzB64m",retweet,,,,,151,,,,fr,,,194,1.3699054502426952e+18,LeahCMa,1.2434599115745976e+18,<a href=,1319411507751493632,Thu Oct 22 22:54:17 +0000 2020,False,Simple Québécois qui se sent obligé de faire la job que les journalistes des médias de masse refusent de faire.,3854,657,132,2,,InfoMatrice,3639,,,False,14,2021-03-11,Moderna,,,,,,,,,,,,boire sans uriner,,,,,,,,,,
289,1377879493176614916,https://twitter.com/Thorpak47/status/1377879493176614916,Fri Apr 02 07:04:05 +0000 2021,2021-04-02 07:04:05,Thorpak47,Au fait le vaccin pour les « gueux » AstraZeneca est celui qui protège le mieux et le plus vite avec une seule dose. Jai déjà plusieurs patients qui ont eu le covid19 après une dose de Pfizer et aucun encore avec AstraZeneca alors que plusieurs ont été exposés dans leur famille.,retweet,,,,,1740,,,,fr,,,460,1.3778696859879383e+18,DocArnica,115903534.0,<a href=,48355921,Thu Jun 18 13:55:05 +0000 2009,False,Les politiques n'ont plus que le pouvoir de nuire et de ralentir les mutations.,105120,1122,4191,20,,rage against the machine. je suis charlie,65459,,http://www.doyoubuzz.com/florian-cadot,False,7,2021-04-02,,,"AstraZeneca, Pfizer, AstraZeneca",,,,,,,,,,,,,,,,,,,,
290,1371933463402721283,https://twitter.com/Marguerite_CAQ/status/1371933463402721283,Tue Mar 16 21:16:41 +0000 2021,2021-03-16 21:16:41,Marguerite_CAQ,Hier jai reçu le vaccin #AstraZeneca et je me sens en pleine forme. Je salue le travail de tous ceux qui oeuvrent dans le cadre de cette campagne de vaccination sans précédent pour nous protéger tous et chacun de la #COVID19. #polqc,retweet,,astrazeneca covid19 polqc,,,227,,,,fr,,,20,1.3718824289235272e+18,Kathleen_Weil,600453895.0,<a href=,731303736,Wed Aug 01 19:32:53 +0000 2012,False,"Doctorat et postdoctorat en communication, ministre responsable des Aînés et des Proches aidants, auteure, députée de #Prévost #CAQ",4516,13911,1705,172,,Marguerite Blais - Coalition Avenir Québec,16010,,,True,21,2021-03-16,,,AstraZeneca,,,,,,,,,campagne de vaccination sans précédent,,,polqc,,,,,,,,
291,1454852839336030215,https://twitter.com/PhiloTango/status/1454852839336030215,Sun Oct 31 16:48:41 +0000 2021,2021-10-31 16:48:41,PhiloTango,#ITALIE +1 +1 +1 24 ans décédé d’une #hémorragie cérébrale 10 jours après #vaccin #Pfizer  https://t.co/uVrD0meYMD #Covid_19 #COVID #COVID19 #pharmacovigilance #NonAuVaccinObligatoire,retweet,,italie hémorragie vaccin pfizer covid_19 covid covid19 pharmacovigilance nonauvaccinobligatoire,,https://www.lapekoranera.it/2021/10/27/muore-24-enne-per-emorragia-cerebrale-10-giorni-prima-aveva-fatto-il-vaccino-pfizer/,498,,,,fr,,False,460,1.45484907026312e+18,Laissonslespre1,1.2442809313572086e+18,<a href=,1353051377631543296,Sat Jan 23 18:46:32 +0000 2021,False,Dans quelle société sommes-nous ? Injecter les enfants à l'ARNm n'a aucun sens. Priver de travail et de ressource pour une cause vaccinale n'a aucun sens.,18748,516,1037,0,France,PhiloTango - mask et blok tous les hémorroïdes !,34988,,,FALSE,16,2021-10-31,,,Pfizer,,,,,,,,,,,,,,,,,,,,
292,1430745411376009216,https://twitter.com/4lrem1/status/1430745411376009216,Thu Aug 26 04:14:22 +0000 2021,2021-08-26 04:14:22,4lrem1,"Les contrats signés entre Pfizer et les états pour le pseudo-vaccin Covid rendu publique.Commande Brésil:100 millions de doses à 10€ l’unité..coût de revient 1,5€. Commande UE:1,8 milliards de doses à 30€ la pièce, faites vos calculs..le casse du siècle.. c’est nous qui payons",retweet,,,,,1329,,,,fr,,,830,1.4304263308066035e+18,LCamerado,1.1133848116017684e+18,<a href=,1126375554188550144,Thu May 09 06:37:13 +0000 2019,False,Les moutons méritent d'être traités comme des moutons 😋,28996,304,1014,3,,4LREM la constance variable,47496,,,FALSE,4,2021-08-26,,,Pfizer,,,,,,,,,"Commande Brésil, Commande UE",,,,,,,,,,,
293,1424826615083716615,https://twitter.com/jcd92410/status/1424826615083716615,Mon Aug 09 20:15:11 +0000 2021,2021-08-09 20:15:11,jcd92410,"14 israéliens qui ont reçu leur 3e dose de #Pfizer infectés par le #Covid19, 2 sont à l'hôpital.  https://t.co/B4Agvq5nqP  #NonAuPassDeLaHonte  #manif14août",retweet,,pfizer covid19 nonaupassdelahonte manif14août,,https://www.timesofisrael.com/tv-14-israelis-who-got-3rd-shot-later-infected-with-covid-19/,321,,,,fr,,False,249,1.424803855238316e+18,PRobesss,1.3149940457987523e+18,<a href=,104757952,Thu Jan 14 08:58:39 +0000 2010,False,,4343,316,250,17,France,jc dauphin,21363,,,FALSE,20,2021-08-09,,,Pfizer,,,,,,,,,,,,,,,israéliens,,,,,
294,1459560052671528964,https://twitter.com/4Tchat/status/1459560052671528964,Sat Nov 13 16:33:28 +0000 2021,2021-11-13 16:33:28,4Tchat,#NiOubli #NiPardon  #manifs13novembre #noussavons #GiletsJaunes #ilsmentent Pour information à @BFMTV @LCI @TF1 @France2tv @France3tv @lemondefr @leparisien @CNEWS @20Minutes @AFP #COVID19 @franceinter @LEXPRESS @LePoint @LesEchos #Pfizergate #ScandalePfizer #ScandaleDetat !!! https://t.co/fMoFyPzrDJ,retweet,,nioubli nipardon manifs13novembre noussavons giletsjaunes ilsmentent covid19 pfizergate scandalepfizer scandaledetat,,,2,,,,fr,,,2,1.4595590681426125e+18,PouvoirUn,7.093865403052728e+17,<a href=,1129087959339327488,Thu May 16 18:15:21 +0000 2019,False,#OSINT (Open Source Intelligence) #TwitterBot🤖#TheGreenNation  #FranceVerte🇫🇷#LegalizeCannabis🌱 #EndTheWarOnDrugs #LegalizeIt🌱#NationsUnies🇺🇳 #,179707,8167,3859,34,Belgium 🇧🇪🇪🇺,🇧🇪🇫🇷Chat4.0🇮🇹🇺🇸🇨🇦🇪🇸🇩🇪🇨🇿🇵🇱🇭🇺,956984,,https://twitter.com/search?q=chat4.0&src=typed_query&f=live,FALSE,16,2021-11-13,,,,,,,,"BFMTV, LCI, TF1, France2tv, France3tv, lemondefr, leparisien, CNEWS, 20Minutes, AFP, franceinter, LEXPRESS, LePoint, LesEchos",,,,,,,,,,,,,,,
295,1448908226020487169,https://twitter.com/JMarfeuil/status/1448908226020487169,Fri Oct 15 07:06:55 +0000 2021,2021-10-15 07:06:55,JMarfeuil,"#Vaccination #Covid19 | Vous pouvez désormais vous faire vacciner chez votre médecin ou chez votre pharmacien, avec #Pfizer. ✅Tous les vaccins contre la Covid-19 sont désormais disponibles chez ces professionnels.  👉N'hésitez plus, rdv dès maintenant sur https://t.co/7PqI0zzqLe https://t.co/VFgqpRDdPe",retweet,,vaccination covid19 pfizer,,,48,,,,fr,,,50,1.4438632571739707e+18,Sante_Gouv,109263459.0,<a href=,1383665551998816259,Sun Apr 18 06:17:04 +0000 2021,False,"En Marche et vigilante. Bilan en 2022. Inclusion et accessibilité pour les personnes handicapées. Bloquée par G Miller ... Anti RN, FI, CGT, UNEF, chaines infos",19546,1403,4402,1,,Jo Marfeuil,66437,,,FALSE,7,2021-10-15,,,Pfizer,,,,,"médecin, pharmacien, professionnels",,,,,,,,,,,,,,,
296,1455957461819699215,https://twitter.com/Pix_77/status/1455957461819699215,Wed Nov 03 17:58:03 +0000 2021,2021-11-03 17:58:03,Pix_77,"Qu’est-ce que le «Pfizergate», mettant en cause un sous-traitant du labo chargé d’essais cliniques pour le vaccin anti-Covid ?   Allo @Pfizer ?  https://t.co/F3ItzxheQs",retweet,,,,,405,,,,fr,,,237,1.4559539239912776e+18,Poulin2012,474073938.0,<a href=,832743134,Wed Sep 19 06:55:35 +0000 2012,False,🇫🇷🎖️,6856,63,179,7,,🚀 R 75 🚀,1105,,,FALSE,17,2021-11-03,,,"Pfizergate, Pfizer",,,,,,,,,,,,,,,,,,,,
297,1380633335840583685,https://twitter.com/ThomasCook_twit/status/1380633335840583685,Fri Apr 09 21:26:52 +0000 2021,2021-04-09 21:26:52,ThomasCook_twit,"On parle de Johnson &amp; Johnson mais pas beaucoup de #Valneva, la société française qui a développé un vaccin contre le #Covid_19 à Nantes et qui va vendre son vaccin en Angleterre parce que ce sont eux qui lont financé. La start-up nation, quil disait... https://t.co/ax33e4KHnQ",retweet,,valneva covid_19,,,432,,,,fr,,,314,1.3805951230509752e+18,realmarcel1,1.347928939461804e+18,<a href=,381495203,Wed Sep 28 12:46:54 +0000 2011,False,,187,15,105,0,Marseille,Thomas Cook,669,,,False,21,2021-04-09,Valneva,,"Johnson, Johnson",,,,,,,,,,,,,,,,,,,,
